# Dates worked on: 25/09/2023 - 01/10/2023

## Name: Bolu Yomi-Adeyemi
## Username: boluya


![Screenshot 2023-10-01 at 7 46 51 PM](https://github.com/COSC-499-W2023/year-long-project-team-16/assets/119131124/52e88761-cc2c-4c7c-8f0d-3b7f52605dcf)

### My Completed tasks:
Researched the tech stack that will be needed for the project.

Wrote down some of the software we will need to use in the project.

# Dates worked on: 01/10/2023 - 08/10/2023

## Name: Bolu Yomi-Adeyemi
## Username: boluya

<img width="1048" alt="Screenshot 2023-10-08 at 4 28 51 PM" src="https://github.com/COSC-499-W2023/year-long-project-team-16/assets/119131124/52cedba8-f3d7-41f6-8739-584045e76895">

### Tasks:
Designing a potential mockup that we could use for our project. (In Progress)

**No Completed Tasks

<img width="1440" alt="Screenshot 2023-10-08 at 4 35 31 PM" src="https://github.com/COSC-499-W2023/year-long-project-team-16/assets/119131124/a5441d8c-98ad-4019-8f9e-2125b6efc85a">

# Dates worked on: 09/10/2023 - 22/10/2023

## Name: Bolu Yomi-Adeyemi
## Username: boluya

<img width="1069" alt="Screenshot 2023-10-22 at 8 52 01 PM" src="https://github.com/COSC-499-W2023/year-long-project-team-16/assets/119131124/9ffcf58d-8f23-40ce-a809-2ab029536b93">

### Tasks:
Made Web Application Mockup 3 (Completed) <br>
Designing the dashboard (In Progress) <br>

![Screenshot 2023-10-22 at 8 56 09 PM](https://github.com/COSC-499-W2023/year-long-project-team-16/assets/119131124/0dfdb528-135d-4c0d-8d91-78300128597a)

# Dates worked on: 22/10/2023 - 29/10/2023

## Name: Bolu Yomi-Adeyemi
## Username: boluya

<img width="1091" alt="Screenshot 2023-10-29 at 9 02 27 PM" src="https://github.com/COSC-499-W2023/year-long-project-team-16/assets/119131124/5910af75-5af9-410d-a6d9-a337c370ef55">

### Tasks:
Designing the settings page (In Progress) <br>
Designing the My Content page (In Progress) <br>
Designing the My Profile page (In Progress) <br>

![Screenshot 2023-10-29 at 9 07 14 PM](https://github.com/COSC-499-W2023/year-long-project-team-16/assets/119131124/4af7ee41-a7fd-46f2-8755-5f0a99e847f6)

# Dates worked on: 29/10/2023 - 05/11/2023

## Name: Bolu Yomi-Adeyemi
## Username: boluya

![Screenshot 2023-11-05 at 6 20 51 PM](https://github.com/COSC-499-W2023/year-long-project-team-16/assets/119131124/5d638c58-1c80-4b3e-87f9-d6f576a409c4)


### Tasks:
Designing the new home page using HTML/CSS (In Progress) <br>
Implementation of AI API so we could generate courses (In Progress) <br>

![Screenshot 2023-11-05 at 6 43 15 PM](https://github.com/COSC-499-W2023/year-long-project-team-16/assets/119131124/671bac14-d13e-48e3-898a-b899df94e9fd)

# Dates worked on: 05/11/2023 - 12/11/2023

## Name: Bolu Yomi-Adeyemi
## Username: boluya

<img width="1083" alt="Screenshot 2023-11-12 at 9 38 10 PM" src="https://github.com/COSC-499-W2023/year-long-project-team-16/assets/119131124/0c7216eb-ed67-41cd-b8d5-a32a13d3988a">


### Tasks:
Designing the new home page using HTML/CSS (Completed) <br>
Implementation of AI API so we could generate courses (In Progress) <br>
Implementing Mobile Responsiveness (In Progress) <br>

<img width="1425" alt="Screenshot 2023-11-12 at 9 40 10 PM" src="https://github.com/COSC-499-W2023/year-long-project-team-16/assets/119131124/459035d5-3e67-476e-8b02-e785907b5b0f">

# Dates worked on: 12/11/2023 - 26/11/2023

## Name: Bolu Yomi-Adeyemi
## Username: boluya

![Screenshot 2023-11-26 at 8 44 49 PM](https://github.com/COSC-499-W2023/year-long-project-team-16/assets/119131124/2e323898-67bc-4a12-8bab-bbf6d1557c19)



### Tasks:
Designing the new home page using HTML/CSS (Completed) <br>
Designing and Implementing Mobile Responsiveness in Home Page (Completed) <br>

![Screenshot 2023-11-26 at 10 08 17 PM](https://github.com/COSC-499-W2023/year-long-project-team-16/assets/119131124/e3eb4d9a-959c-4c37-8621-1de1a0125be9)

# Dates worked on: 12/11/2023 - 26/11/2023

## Name: Bolu Yomi-Adeyemi
## Username: boluya

![Screenshot 2023-11-26 at 8 44 49 PM](https://github.com/COSC-499-W2023/year-long-project-team-16/assets/119131124/2e323898-67bc-4a12-8bab-bbf6d1557c19)



### Tasks:
Designing the new home page using HTML/CSS (Completed) <br>
Designing and Implementing Mobile Responsiveness in Home Page (Completed) <br>

![Screenshot 2023-11-26 at 10 08 17 PM](https://github.com/COSC-499-W2023/year-long-project-team-16/assets/119131124/e3eb4d9a-959c-4c37-8621-1de1a0125be9)

# Dates worked on: 26/11/2023 - 03/12/2023

## Name: Bolu Yomi-Adeyemi
## Username: boluya

![Screenshot 2023-12-03 at 11 14 22 PM](https://github.com/COSC-499-W2023/year-long-project-team-16/assets/119131124/4d93d27e-a13e-4e53-995e-6f4e9bcd4ee9)



### Tasks:
Implemented the Download and Share functions on the Content Page (Completed) <br>
Redesgined the Content Page (Completed) <br>
Connected the database to the Content Page to show all the generated files (Completed) <br>
Completed the UI section of Design Document (Completed) <br>

![Screenshot 2023-12-03 at 11 18 32 PM](https://github.com/COSC-499-W2023/year-long-project-team-16/assets/119131124/c50b165a-abf8-4233-b5da-2ca1ce5e2533)

# Dates worked on: 08/01/2023 - 14/01/2023

## Name: Bolu Yomi-Adeyemi
## Username: boluya

<img width="1071" alt="Screenshot 2024-01-14 at 6 41 09 PM" src="https://github.com/COSC-499-W2023/year-long-project-team-16/assets/119131124/42e560b3-5e91-4764-bf3e-29921804c71e">

### Tasks:
Implemented an auto-scroll that when the share button is clicked, it scrolls to the share form (Completed) <br>
File preview (In Progress) <br>
My Content Page reorganisation (In Progress) <br>

<img width="1404" alt="Screenshot 2024-01-14 at 6 52 22 PM" src="https://github.com/COSC-499-W2023/year-long-project-team-16/assets/119131124/b78a13de-5207-4579-8ca9-12223ad25a4e">


# Dates worked on: 14/01/2024 - 21/01/2024

## Name: Bolu Yomi-Adeyemi
## Username: boluya

Link to the branch this week:[  ](https://github.com/COSC-499-W2023/year-long-project-team-16/tree/DashboardHome)and [
](https://github.com/COSC-499-W2023/year-long-project-team-16/tree/v2.0)

<img width="1102" alt="Screenshot 2024-01-21 at 4 23 23 PM" src="https://github.com/COSC-499-W2023/year-long-project-team-16/assets/119131124/50a85957-8515-4200-8e39-d600bcd17e0b">


### Tasks:
File preview (In Progress) <br>
My Content Page Reorganisation (Completed) <br>
Sharing for pop-up when share button is clicked (In Progress) <br>

<img width="1359" alt="Screenshot 2024-01-21 at 4 26 10 PM" src="https://github.com/COSC-499-W2023/year-long-project-team-16/assets/119131124/f78f7afd-2564-4ce0-a1bb-2bf6fb26e434">

# Dates worked on: 21/01/2024 - 28/01/2024

## Name: Bolu Yomi-Adeyemi
## Username: boluya

Link to the branch for this week: (https://github.com/COSC-499-W2023/year-long-project-team-16/tree/v2.0) and (https://github.com/COSC-499-W2023/year-long-project-team-16/tree/v2.0-review)

<img width="1116" alt="Screenshot 2024-01-28 at 5 53 01 PM" src="https://github.com/COSC-499-W2023/year-long-project-team-16/assets/119131124/d26a8332-05d4-416f-a19d-5f5d642fa462">



### Tasks:
File preview (In Progress) <br>
My Content Page Reorganisation (Completed) <br>
Sharing for pop-up when share button is clicked (In Progress) <br>
Review feature (In Progress) <br>
Bug fix for linking content db with users db <br>

<img width="1135" alt="Screenshot 2024-01-28 at 5 58 40 PM" src="https://github.com/COSC-499-W2023/year-long-project-team-16/assets/119131124/4849e5b4-0781-4cb7-978d-166d93f17f13">

# Dates worked on: 28/01/2024 - 04/02/2024

## Name: Bolu Yomi-Adeyemi
## Username: boluya

Link to the branch for this week: (https://github.com/COSC-499-W2023/year-long-project-team-16/tree/v2.0) and (https://github.com/COSC-499-W2023/year-long-project-team-16/tree/v2.0-review) and (https://github.com/COSC-499-W2023/year-long-project-team-16/tree/v2.0-delete)

![Screenshot 2024-02-04 at 2 38 06 PM](https://github.com/COSC-499-W2023/year-long-project-team-16/assets/119131124/2114b17c-b682-4888-9c3e-23fc07b874a7)




### Tasks:
File preview (In Progress) <br>
My Content Page Reorganisation (Completed) <br>
Sharing for pop-up when share button is clicked (In Progress) <br>
Review feature (Completed) <br>
Design for review feature (In Progress) <br>
Bug fix for linking content db with users db (Completed) <br>
Delete feature (Completed) <br>

![Screenshot 2024-02-04 at 2 41 52 PM](https://github.com/COSC-499-W2023/year-long-project-team-16/assets/119131124/9a20f6c6-d581-477a-ba3d-b889861bc6ab)

# Dates worked on: 04/02/2024 - 11/02/2024

## Name: Bolu Yomi-Adeyemi
## Username: boluya

![Screenshot 2024-02-11 at 10 28 50 PM](https://github.com/COSC-499-W2023/year-long-project-team-16/assets/119131124/8079946a-8b66-4418-b579-6c22d016364b)





### Tasks:
File preview (In Progress) <br>
Sharing for pop-up when share button is clicked (In Progress) <br>
Review feature (In Progress) <br>
Working on slides download (In Progress) <br>
Working on the backend of the review system (In Progress) <br>
Working on sharing feature (In Progress) <br>
Design for review feature (In Progress) <br>
Bug fix for linking content db with users db (Completed) <br>
Delete feature (Completed) <br>

![Screenshot 2024-02-11 at 10 38 36 PM](https://github.com/COSC-499-W2023/year-long-project-team-16/assets/119131124/dbbb869f-7677-4818-97f2-d9be848c352d)

# Dates worked on: 11/02/2024 - 18/02/2024

## Name: Bolu Yomi-Adeyemi
## Username: boluya

<img width="793" alt="Screenshot 2024-02-18 at 10 40 05 AM" src="https://github.com/COSC-499-W2023/year-long-project-team-16/assets/119131124/f0689135-b2fa-4eb0-ac48-e60ea5f9b838">

### Tasks:
Sharing for pop-up when share button is clicked (In Progress) <br>
Review feature (In Progress) <br>
Working on slides download (Completed) <br>
Working on the backend of the review system (In Progress) <br>
Working on sharing feature (In Progress) <br>
Design for review feature (In Progress) <br>
Bug fix for linking content db with users db (Completed) <br>
Delete feature (Completed) <br>

<img width="1426" alt="Screenshot 2024-02-18 at 10 42 46 AM" src="https://github.com/COSC-499-W2023/year-long-project-team-16/assets/119131124/52dd8e0c-ba3f-4421-9b93-7f0ece84631a">

# Dates worked on: 25/02/2024 - 03/03/2024

## Name: Bolu Yomi-Adeyemi
## Username: boluya

<img width="1070" alt="Screenshot 2024-03-03 at 11 10 25 PM" src="https://github.com/COSC-499-W2023/year-long-project-team-16/assets/119131124/456b335e-564c-437e-8306-01b5c5bc8f74">


### Tasks:
Sharing for pop-up when share button is clicked (In Progress) <br>
Review feature (In Progress) <br>
Working on slides download (Completed) <br>
Working on the backend of the review system (Completed) <br>
Working on sharing feature (Completed) <br>
Design for review feature (In Progress) <br>
Bug fix for linking content db with users db (Completed) <br>
Delete feature (Completed) <br>

<img width="1424" alt="Screenshot 2024-03-03 at 11 12 33 PM" src="https://github.com/COSC-499-W2023/year-long-project-team-16/assets/119131124/1fb4b2c7-0e81-4af2-887d-4c140ce90bcb">

# Dates worked on: 03/03/2024 - 10/03/2024

## Name: Bolu Yomi-Adeyemi
## Username: boluya

![Screenshot 2024-03-10 at 7 45 29 PM](https://github.com/COSC-499-W2023/year-long-project-team-16/assets/119131124/3a89fc75-fd71-4789-9ac4-52ea951b6997)

I worked directly on the v2.0 branch because it was on the index page and it was more a design feature sort of (the Information buttons on the Generate Content form)


### Tasks:
Sharing for pop-up when share button is clicked (In Progress) <br>
Review feature (In Progress) <br>
Working on slides download (Completed) <br>
Working on the backend of the review system (Completed) <br>
Working on sharing feature (Completed) <br>
Design for review feature (In Progress) <br>
Bug fix for linking content db with users db (Completed) <br>
Delete feature (Completed) <br>
Information button feature (Completed) <br>

![Screenshot 2024-03-10 at 7 59 29 PM](https://github.com/COSC-499-W2023/year-long-project-team-16/assets/119131124/7b1bda7f-6eca-47be-bf2b-4bf2136c69ac)

# Dates worked on: 10/03/2024 - 17/03/2024

## Name: Bolu Yomi-Adeyemi
## Username: boluya

<img width="1065" alt="Screenshot 2024-03-17 at 8 19 46 PM" src="https://github.com/COSC-499-W2023/year-long-project-team-16/assets/119131124/67b48511-0313-4509-bb62-7523504f9f16">



### Tasks:
Sharing for pop-up when share button is clicked (In Progress) <br>
Review feature (In Progress) <br>
Working on slides download (Completed) <br>
Working on the backend of the review system (Completed) <br>
Working on sharing feature (Completed) <br>
Design for review feature (In Progress) <br>
Bug fix for linking content db with users db (Completed) <br>
Delete feature (Completed) <br>
Information button feature (Completed) <br>
Renaming function (In Progress)

<img width="1235" alt="Screenshot 2024-03-17 at 8 22 36 PM" src="https://github.com/COSC-499-W2023/year-long-project-team-16/assets/119131124/3a373373-870d-4ff8-9c93-503148383bee">

# Dates worked on: 17/03/2024 - 24/03/2024

## Name: Bolu Yomi-Adeyemi
## Username: boluya

![Screenshot 2024-03-24 at 10 55 04 PM](https://github.com/COSC-499-W2023/year-long-project-team-16/assets/119131124/bd8caa72-a24c-4bb4-9509-3418c3b184d9)



### Tasks:
Sharing for pop-up when share button is clicked (In Progress) <br>
Review feature (In Progress) <br>
Working on slides download (Completed) <br>
Working on the backend of the review system (Completed) <br>
Working on sharing feature (Completed) <br>
Design for review feature (In Progress) <br>
Bug fix for linking content db with users db (Completed) <br>
Delete feature (Completed) <br>
Information button feature (Completed) <br>
Renaming function (In Progress) <br>
Linking review with slide (In Progress) <br>

![Screenshot 2024-03-24 at 10 57 34 PM](https://github.com/COSC-499-W2023/year-long-project-team-16/assets/119131124/e0bf4d68-3bf6-4fc4-a2af-21671b15fdd6)

# Dates worked on: 24/03/2024 - 31/03/2024

## Name: Bolu Yomi-Adeyemi
## Username: boluya

<img width="1069" alt="Screenshot 2024-03-31 at 9 54 25 PM" src="https://github.com/COSC-499-W2023/year-long-project-team-16/assets/119131124/2e02c5ff-8247-4ba6-a395-aee548c7eda4">




### Tasks:
Sharing for pop-up when share button is clicked (In Progress) <br>
Review feature (In Progress) <br>
Working on slides download (Completed) <br>
Working on the backend of the review system (Completed) <br>
Working on sharing feature (Completed) <br>
Design for review feature (In Progress) <br>
Bug fix for linking content db with users db (Completed) <br>
Delete feature (Completed) <br>
Information button feature (Completed) <br>
Renaming function (In Progress) <br>
Linking review with slide (In Progress) <br>

![Screenshot 2024-03-24 at 10 57 34 PM](https://github.com/COSC-499-W2023/year-long-project-team-16/assets/119131124/e0bf4d68-3bf6-4fc4-a2af-21671b15fdd6)

# Dates worked on: 31/03/2024 - 07/04/2024

## Name: Bolu Yomi-Adeyemi
## Username: boluya

![Screenshot 2024-04-07 at 11 03 02 PM](https://github.com/COSC-499-W2023/year-long-project-team-16/assets/119131124/b51bc86e-56b0-479d-8bc3-a70fcaf320c1)

### Tasks:
Sharing for pop-up when share button is clicked (Completed) <br>
Review feature (Completed) <br>
Working on slides download (Completed) <br>
Working on the backend of the review system (Completed) <br>
Working on sharing feature (Completed) <br>
Delete feature (Completed) <br>
Information button feature (Completed) <br>
Adjustment of share feature (It sends as an attachment rather than a downloadable link) (Completed) <br>

![Screenshot 2024-04-07 at 11 05 25 PM](https://github.com/COSC-499-W2023/year-long-project-team-16/assets/119131124/a570193b-a983-4b71-874b-f177326dd1d9)





























